{
  "schema_version": 2,
  "_note": "管道层（Bindings）：类型层对象/链接的数据从哪来、怎么清洗、怎么物化。object_bindings: source(结构化 {table, columns:{别名:源列}}，编译期按属性类型 CAST) 或 source_sql(自由查询)；clean 清洗规则；optional 源表缺失可跳过。link_bindings: build_sql 物化边（引用 obj_*/lnk_*）。",
  "object_bindings": [
    {
      "object": "person",
      "source_table": "通话记录",
      "source_sql": "SELECT 主体 AS raw_name FROM 通话记录 UNION SELECT 对端 FROM 通话记录 UNION SELECT 主体 FROM 轨迹出行 UNION SELECT 主体 FROM 公开OSINT UNION SELECT 主体 FROM 银行流水 UNION SELECT 被举报人 AS raw_name FROM 举报材料",
      "clean": [
        "strip",
        "exclude_org_tokens"
      ]
    },
    {
      "object": "org",
      "source": {
        "table": "工商信息",
        "columns": {
          "raw_name": "主体",
          "legal_rep": "法人",
          "status": "状态",
          "relation": "关联"
        }
      },
      "optional_columns": [
        "法人",
        "状态",
        "关联"
      ]
    },
    {
      "object": "account",
      "source_table": "银行流水",
      "source_sql": "SELECT 主体 AS raw_name FROM 银行流水 UNION SELECT 对方 FROM 银行流水"
    },
    {
      "object": "transaction",
      "source": {
        "table": "银行流水",
        "columns": {
          "from_raw": "主体",
          "to_raw": "对方",
          "amount": "金额",
          "currency": "币种",
          "date": "日期"
        }
      },
      "optional_columns": [
        "币种"
      ],
      "_note_transform": "DE_AMOUNT/DE_DATE 的 clean_rule 在 py 层（fetch 后）执行，晚于编译期 TRY_CAST——千分位/中文日期必须在 SQL 投影内 CAST 前抢救（REQ-D-009 transform）。strip_currency 同链剥货币符与空白。",
      "transform": {
        "amount": [
          "strip_thousands",
          "strip_currency"
        ],
        "date": [
          "cn_date_norm",
          "pad_date"
        ]
      }
    },
    {
      "object": "person_identity",
      "optional": true,
      "source": {
        "table": "人员信息",
        "columns": {
          "raw_name": "姓名",
          "id_type": "证件类型",
          "id_card": "身份证号",
          "phone": "手机号",
          "gender": "性别",
          "case_type": "案件类别"
        }
      },
      "optional_columns": [
        "证件类型",
        "身份证号",
        "手机号",
        "性别",
        "案件类别"
      ],
      "_note": "数据接入演示源表（五格式夹具见 data/test/ingest/）。身份证/手机为 string 直通投影，DE clean_rule 经 prop_de_clean 在 py 层自动挂接（despace / strip_cc+digits_only），无需重复声明 transform。"
    },
    {
      "object": "call",
      "source": {
        "table": "通话记录",
        "columns": {
          "caller_raw": "主体",
          "callee_raw": "对端",
          "date": "日期",
          "times": "次数"
        }
      },
      "optional_columns": [
        "日期"
      ],
      "transform": {
        "date": [
          "cn_date_norm",
          "pad_date"
        ]
      }
    },
    {
      "object": "trackpoint",
      "source": {
        "table": "轨迹出行",
        "columns": {
          "person_raw": "主体",
          "location": "地点",
          "date": "日期",
          "timestamp": "时刻"
        }
      },
      "transform": {
        "date": [
          "cn_date_norm",
          "pad_date"
        ],
        "timestamp": [
          "cn_datetime_norm"
        ]
      },
      "optional_columns": [
        "时刻"
      ],
      "_note_time": "timestamp 声明为 optional_columns（B5-01）：源表「轨迹出行」当前只有日期列、无时刻列，缺列降级为类型化 NULL 而不硬失败。待接入手机信令/GPS 等带时刻数据源时，只需在源表补「时刻」列即自动生效，判据代码无需改动。"
    },
    {
      "object": "location",
      "_note": "维度实体：从 obj_trackpoint 反向物化（不新增数据源）。source_sql 中 std_address 先用 raw_address 占位，编译器物化后由 scripts/enrich_location.py UPDATE 修正为 dual_segment_key（路名主干+行政区划双段归并）。admin 五级归属由 AdminMatcher 离线匹配（重写实现，非 AGPL 源码）。geocode_cache 为 optional 二次 JOIN（未编码时坐标 NULL，不报错降级）。",
      "source_sql": "SELECT DISTINCT location AS raw_address, location AS std_address, NULL AS province, NULL AS prefecture, NULL AS county, NULL AS township, NULL AS admin_code, NULL AS lat, NULL AS lng, 'GCJ-02' AS coord_sys, 'raw_fallback' AS geocode_source, NULL AS geocode_confidence, NULL AS geocoded_at FROM obj_trackpoint WHERE location IS NOT NULL AND location <> ''",
      "clean": [
        "strip"
      ]
    },
    {
      "object": "bid_project",
      "source": {
        "table": "招投标档案",
        "columns": {
          "title": "项目",
          "winner_raw": "中标方",
          "pub_date": "中标公示日",
          "leader": "分管领导"
        }
      },
      "optional_columns": [
        "分管领导"
      ],
      "transform": {
        "pub_date": [
          "cn_date_norm",
          "pad_date"
        ]
      }
    },
    {
      "object": "clue",
      "optional": true,
      "source": {
        "table": "clue_disposal_status",
        "columns": {
          "clue_id": "clue_id",
          "status": "status",
          "last_operator": "operator",
          "note": "note",
          "updated_at": "updated_at"
        }
      }
    },
    {
      "object": "tipoff",
      "optional": true,
      "source": {
        "table": "举报材料",
        "columns": {
          "title": "分类",
          "submit_date": "举报日期",
          "target_raw": "被举报人",
          "reporter_raw": "举报人",
          "content_raw": "内容"
        }
      },
      "transform": {
        "submit_date": [
          "cn_date_norm",
          "pad_date"
        ]
      }
    },
    {
      "object": "osint_article",
      "optional": true,
      "source": {
        "table": "公开OSINT",
        "columns": {
          "raw_name": "主体",
          "info_text": "公开信息",
          "pub_date": "发布日期",
          "source_name": "来源",
          "crawled_at": "采集时间",
          "retention_days": "保留天数"
        }
      },
      "optional_columns": [
        "采集时间",
        "保留天数"
      ],
      "transform": {
        "pub_date": [
          "cn_date_norm",
          "pad_date"
        ]
      }
    },
    {
      "object": "item",
      "optional": true,
      "source": {
        "table": "物品登记",
        "columns": {
          "title": "名称",
          "item_type": "类型",
          "identifiers": "标识",
          "primary_digest": "标识摘要",
          "descriptors": "特征",
          "location": "地点",
          "lat": "纬度",
          "lng": "经度",
          "track": "轨迹"
        }
      },
      "optional_columns": [
        "标识",
        "标识摘要",
        "特征",
        "地点",
        "纬度",
        "经度",
        "轨迹"
      ],
      "_note": "源表由 scripts/prep_item_registry.py 预装配（物品台账+物品轨迹 → 宽表）：digest/类型映射/轨迹序列化在 py 层完成（R14 摘要口径唯一），SQL 层只做等值投影。optional:true → 源表缺失时跳过（与 clue 尾段同口径），不阻断既有管线。持有不入本表——多段时态归 hold_record + lnk_holds。"
    },
    {
      "object": "hold_record",
      "optional": true,
      "source": {
        "table": "物品持有",
        "columns": {
          "holder_raw": "持有人",
          "item_title": "物品名称",
          "item_type": "类型",
          "primary_digest": "标识摘要",
          "start_date": "开始日期",
          "end_date": "结束日期",
          "start_time": "开始时刻",
          "end_time": "结束时刻",
          "reg_order": "登记序号"
        }
      },
      "optional_columns": [
        "开始日期",
        "结束日期",
        "开始时刻",
        "结束时刻",
        "登记序号"
      ],
      "_note": "源表由 scripts/prep_item_registry.py 预装配（物品持有登记 + 进程内索引关联 → 携带派生键 类型/标识摘要）。日期/时刻已在 prep 层按精度分流（R5 缺失=NULL 无哨兵），此处直通 TRY_CAST，无需 transform。R14：源表无凭证明文列，关联键只有 (类型, 标识摘要)。"
    }
  ],
  "link_bindings": [
    {
      "link": "transfers",
      "_note": "REQ-P-031：双列方案——from_account/to_account 保留 raw（图库 _flow_source 双轨同源 + overpass 自连接兼容），from_account_id/to_account_id 为 account 外键（LEFT JOIN 未命中不丢边）。",
      "build_sql": "SELECT t.txn_id, t.from_raw AS from_account, t.to_raw AS to_account, fa.account_id AS from_account_id, ta.account_id AS to_account_id, t.amount, t.date FROM obj_transaction t LEFT JOIN obj_account fa ON fa.raw_name = t.from_raw LEFT JOIN obj_account ta ON ta.raw_name = t.to_raw",
      "normalize": [
        {
          "as": "from_account_id",
          "alias": "fa",
          "table": "obj_account",
          "on": "fa.raw_name = t.from_raw",
          "select": "fa.account_id"
        },
        {
          "as": "to_account_id",
          "alias": "ta",
          "table": "obj_account",
          "on": "ta.raw_name = t.to_raw",
          "select": "ta.account_id"
        }
      ]
    },
    {
      "link": "calls_to",
      "build_sql": "SELECT c.call_id, p1.person_id AS from_person, p2.person_id AS to_person FROM obj_call c LEFT JOIN obj_person p1 ON p1.raw_name = c.caller_raw LEFT JOIN obj_person p2 ON p2.raw_name = c.callee_raw",
      "normalize": [
        {
          "as": "from_person",
          "alias": "p1",
          "table": "obj_person",
          "on": "p1.raw_name = c.caller_raw",
          "select": "p1.person_id"
        },
        {
          "as": "to_person",
          "alias": "p2",
          "table": "obj_person",
          "on": "p2.raw_name = c.callee_raw",
          "select": "p2.person_id"
        }
      ]
    },
    {
      "link": "owns",
      "build_sql": "SELECT a.account_id, p.person_id AS owner_person, a.raw_name AS owner_raw FROM obj_account a JOIN obj_person p ON p.raw_name = a.raw_name",
      "normalize": [
        {
          "as": "owner_person",
          "alias": "p",
          "table": "obj_person",
          "on": "p.raw_name = a.raw_name",
          "select": "p.person_id"
        }
      ]
    },
    {
      "link": "involved_in",
      "build_sql": "SELECT o.org_id, b.project_id, b.winner_raw FROM obj_bid_project b JOIN obj_org o ON o.raw_name = b.winner_raw",
      "normalize": [
        {
          "as": "org_id",
          "alias": "o",
          "table": "obj_org",
          "on": "o.raw_name = b.winner_raw",
          "select": "o.org_id"
        }
      ]
    },
    {
      "link": "co_located",